{
    "align": [
            {
                "name": "align-groovy",
                "group": "org\\.codehaus\\.groovy",
                "includes": [],
                "excludes": ["groovy-(eclipse-compiler|eclipse-batch|all-tests|xmlrpc|all-jdk14|jdk14|all-minimal)", "http-builder"],
                "reason": "Align Groovy libraries.",
                "author": "Danny Thomas <dannyt@netflix.com>",
                "date": "2016-06-01"
            }
    ],
    "replace": [],
    "substitute": [],
    "deny": [],
    "exclude": [],
    "reject": []
}
