{
    "align": [
        {
            "name": "align-springframework-integration",
            "group": "org\\.springframework\\.integration",
            "includes": [],
            "excludes": ["spring-integration-(smb|java-dsl|kafka|tuple|cassandra|flow|smpp|splunk|httpinvoker|parent|adapter|samples|aws)"],
            "reason": "Align Spring Integration",
            "author": "Danny Thomas <dannyt@netflix.com>",
            "date": "2016-05-16"
        }
    ],
    "replace": [],
    "substitute": [],
    "deny": [],
    "reject": [],
    "exclude": []
}
