{
    "replace": [
        {
            "module": "org.bouncycastle:bcpg-jdk12",
            "with": "org.bouncycastle:bcpg-jdk14",
            "reason": "Ensure that bouncycastle artifacts conflict resolve",
            "author": "Danny Thomas",
            "date": "2026-03-11"
        },
        {
            "module": "org.bouncycastle:bcprov-jdk12",
            "with": "org.bouncycastle:bcprov-jdk14",
            "reason": "Ensure that bouncycastle artifacts conflict resolve",
            "author": "Danny Thomas",
            "date": "2026-03-11"
        }
    ],
    "substitute": [],
    "align": [],
    "deny": [],
    "exclude": [],
    "reject": []
}
