{
    "replace" : [
            {
                "module" : "com.google.collections:google-collections",
                "with" : "com.google.guava:guava",
                "reason" : "Google Collections was superceded by Guava",
                "author" : "Danny Thomas",
                "date" : "2016-04-26T00:00:00.000Z"
            }
    ],
    "align": [],
    "substitute": [],
    "deny": [],
    "exclude": [],
    "reject": []
}
