{
    "align": [
            {
                "name": "align-okhttp3",
                "group": "com\\.squareup\\.okhttp3.*",
                "includes": [],
                "excludes": ["okhttp-ws"],
                "reason": "Align okhttp3",
                "author": "Danny Thomas <dannyt@netflix.com>",
                "date": "2016-10-26"
            }
    ],
    "replace": [],
    "substitute": [],
    "deny": [],
    "exclude": [],
    "reject": []
}
