{
    "align": [
        {
            "name": "align-ribbon",
            "group": "com\\.netflix\\.ribbon",
            "includes": [],
            "excludes": ["ribbon-httpasyncclient"],
            "reason": "Align Ribbon libraries.",
            "author": "Danny Thomas <dannyt@netflix.com>",
            "date": "2016-05-31"
        }
    ],
    "replace": [],
    "substitute": [],
    "deny": [],
    "reject": [],
    "exclude": []
}
