{
    "align": [
            {
                "name": "align-xstream",
                "group": "com.thoughtworks.xstream",
                "match": "EXCLUDE_SUFFIXES",
                "reason": "Align all xstream libraries",
                "author": "Danny Thomas <dannyt@netflix.com>",
                "includes": [],
                "excludes": [],
                "date": "2016-05-15"
            }
    ],
    "replace": [],
    "substitute": [],
    "deny": [],
    "exclude": [],
    "reject": []
}
