{
    "align": [],
    "deny": [],
    "exclude": [],
    "reject": [],
    "replace": [],
    "substitute": [
        {
            "module": "org.apache.commons:commons-configuration2:[2.2,2.7]",
            "with": "org.apache.commons:commons-configuration2:2.8.0",
            "reason": "The versions 2.2 to 2.7 of commons-configuration2 are vulnerable with CVE-2022-33980",
            "author": "mchalupa@netflix.com",
            "date": "2022-07-20"
        }
    ]
}