{
    "align": [
        {
            "name": "align-springfox",
            "group": "io.springfox",
            "includes": ["springfox-(bean-validators|core|schema|spi|spring-web|swagger-common|swagger-ui|swagger2|)"],
            "excludes": [],
            "reason": "Align Springfox libraries.",
            "author": "Remy Tiitre <remy.tiitre@lhv.ee>",
            "date": "2016-09-22"
        }
    ],
    "replace": [],
    "substitute": [],
    "deny": [],
    "reject": [],
    "exclude": []
}
